group	command	option	value	combination	repo_state	transport	platform	stock_git_case	zmin_status	evidence	notes
Administration	bundle	<bundle path>	repo.bundle	create HEAD and branch	two-commit repository with delta-friendly blobs	local	all	git bundle create repo.bundle HEAD <branch>	closed	git_pack_integrity_compat::bundle_create_list_heads_and_unbundle_are_stock_readable	creates a stock-verifiable bundle whose unbundled pack contains readable objects and delta entries
Administration	bundle	<positional:operation>	create	file plus revision args	two-commit repository with delta-friendly blobs	local	all	git bundle create repo.bundle HEAD <branch>	closed	git_pack_integrity_compat::bundle_create_list_heads_and_unbundle_are_stock_readable	create operation positional surface writes a stock-verifiable bundle with stock-readable objects
Administration	bundle	<positional:file>	repo.bundle	create plus revision args	two-commit repository with delta-friendly blobs	local	all	git bundle create repo.bundle HEAD <branch>	closed	git_pack_integrity_compat::bundle_create_list_heads_and_unbundle_are_stock_readable	bundle file positional surface writes a stock-verifiable bundle at the requested path
Administration	bundle	<positional:args>	HEAD <branch>	create plus file	two-commit repository with delta-friendly blobs	local	all	git bundle create repo.bundle HEAD <branch>	closed	git_pack_integrity_compat::bundle_create_list_heads_and_unbundle_are_stock_readable	revision argument positional surface creates a stock-verifiable bundle for HEAD and branch inputs
Administration	bundle	<bundle path>	repo.bundle	list-heads default	Zmin-created stock-verifiable bundle	local	all	git bundle list-heads repo.bundle	closed	git_pack_integrity_compat::bundle_create_list_heads_and_unbundle_are_stock_readable	lists bundle heads like stock Git for an unfiltered bundle query
Administration	bundle	<bundle path>	repo.bundle	list-heads explicit head	Zmin-created stock-verifiable bundle	local	all	git bundle list-heads repo.bundle refs/heads/main	closed	git_pack_integrity_compat::bundle_create_list_heads_and_unbundle_are_stock_readable	lists an explicit branch head like stock Git
Administration	bundle	<bundle path>	repo.bundle	list-heads glob	Zmin-created stock-verifiable bundle	local	all	git bundle list-heads repo.bundle refs/heads/*	closed	git_pack_integrity_compat::bundle_create_list_heads_and_unbundle_are_stock_readable	filters bundle heads by glob like stock Git
Administration	bundle	<bundle path>	repo.bundle	unbundle default	empty target repository	local	all	git bundle unbundle repo.bundle	closed	git_pack_integrity_compat::bundle_create_list_heads_and_unbundle_are_stock_readable	unbundles into an empty repository with stock stdout and readable objects
Administration	bundle	<bundle path>	repo.bundle	unbundle glob	empty target repository	local	all	git bundle unbundle repo.bundle refs/heads/*	closed	git_pack_integrity_compat::bundle_create_list_heads_and_unbundle_are_stock_readable	unbundles filtered refs with stock stdout
Administration	bundle	--version	3	create range then fetch	two-commit repository and target one commit behind	local	all	git bundle create --version=3 versioned.bundle main^..main	closed	git_pack_integrity_compat::bundle_create_accepts_version_option_for_upstream_fetch_suite	creates a v3 range bundle that stock Git verifies and Zmin can fetch to advance the target branch
Administration	bundle	--since	<date>	create main	two-commit repository	local	all	git bundle create since.bundle main --since=<date>	closed	git_pack_integrity_compat::bundle_create_accepts_since_option_for_upstream_fetch_suite	creates a stock-verifiable bundle using a date-limited revision walk
Administration	bundle	<bundle path>	incremental.bundle	verify prerequisite bundle	target repository has prerequisite base commit	local	all	git bundle verify incremental.bundle	closed	git_pack_integrity_compat::bundle_unbundle_accepts_prerequisite_bundles	verifies an incremental prerequisite bundle with exit code 0 like stock Git
Administration	bundle	<bundle path>	incremental.bundle	unbundle prerequisite bundle	target repository has prerequisite base commit	local	all	git bundle unbundle incremental.bundle	closed	git_pack_integrity_compat::bundle_unbundle_accepts_prerequisite_bundles	unbundles an incremental prerequisite bundle with stock stdout and readable objects
Administration	bundle	--version	2	create HEAD	committed repo	local	all	git bundle create --version=2 repo.bundle HEAD	closed	git_pack_integrity_compat::bundle_create_version_values_match_stock_git	stock Git creates a v2 bundle with empty stdout/stderr and a verifiable bundle payload
Administration	bundle	--version	3	create HEAD	committed repo	local	all	git bundle create --version=3 repo.bundle HEAD	closed	git_pack_integrity_compat::bundle_create_version_values_match_stock_git	stock Git creates a v3 bundle with object-format header and a verifiable bundle payload
Administration	bundle	--version	-1	create HEAD	committed repo	local	all	git bundle create --version=-1 repo.bundle HEAD	closed	git_pack_integrity_compat::bundle_create_version_values_match_stock_git	stock Git treats bundle version -1 as its default v2 bundle sentinel
Administration	bundle	--version	1	create HEAD	committed repo	local	all	git bundle create --version=1 repo.bundle HEAD	invalid-input	git_pack_integrity_compat::bundle_create_version_values_match_stock_git	stock Git rejects unsupported numeric bundle version 1 with exit 128 and no bundle side effect
Administration	bundle	--version	4	create HEAD	committed repo	local	all	git bundle create --version=4 repo.bundle HEAD	invalid-input	git_pack_integrity_compat::bundle_create_version_values_match_stock_git	stock Git rejects unsupported numeric bundle version 4 with exit 128 and no bundle side effect
Administration	bundle	--version	1k	create HEAD	committed repo	local	all	git bundle create --version=1k repo.bundle HEAD	invalid-input	git_pack_integrity_compat::bundle_create_version_values_match_stock_git	stock Git accepts k/m/g integer suffix parsing, then rejects expanded bundle version 1024 with exit 128
Administration	bundle	--version	foo	create HEAD	committed repo	local	all	git bundle create --version=foo repo.bundle HEAD	invalid-input	git_pack_integrity_compat::bundle_create_version_values_match_stock_git	stock Git rejects non-numeric bundle version values with option parser stderr and exit 129
Administration	bundle	--version	<empty>	create HEAD	committed repo	local	all	git bundle create --version= repo.bundle HEAD	invalid-input	git_pack_integrity_compat::bundle_create_version_values_match_stock_git	stock Git rejects empty bundle version values with numerical-value parser stderr and exit 129
Administration	bundle	<bundle path>	unsupported bundle format	verify	invalid bundle file	local	all	git bundle verify bad.bundle	invalid-input	git_pack_integrity_compat::bundle_subcommands_reject_unsupported_bundle_format_like_stock_git	stock Git rejects files that do not start with a v2 or v3 bundle header with exit 1
Administration	bundle	<bundle path>	unsupported bundle format	list-heads	invalid bundle file	local	all	git bundle list-heads bad.bundle	invalid-input	git_pack_integrity_compat::bundle_subcommands_reject_unsupported_bundle_format_like_stock_git	stock Git rejects files that do not start with a v2 or v3 bundle header with exit 1
Administration	bundle	<bundle path>	unsupported bundle format	unbundle	invalid bundle file	local	all	git bundle unbundle bad.bundle	invalid-input	git_pack_integrity_compat::bundle_subcommands_reject_unsupported_bundle_format_like_stock_git	stock Git rejects files that do not start with a v2 or v3 bundle header with exit 1 and no pack side effects
