group	command	option	value	combination	repo_state	transport	platform	stock_git_case	zmin_status	evidence	notes
Branching and Merging	checkout	<pathspec>	.	--quiet --no-progress	dirty tracked file and missing tracked file in repository root	local	all	git checkout --quiet --no-progress .	closed	git_worktree_state_compat::checkout_dot_pathspec_restores_root_like_stock_git	dot pathspec restores modified and deleted tracked root files to stock-matching worktree contents without progress output
Branching and Merging	checkout	<pathspec>	.	default reporting	two missing tracked files in repository root	local	all	git checkout .	closed	git_worktree_state_compat::checkout_dot_reports_updated_paths_like_stock_git	dot pathspec checkout emits stock-matching updated-path output and restores missing tracked files
Branching and Merging	checkout	<positional:args>	.	default reporting	two missing tracked files in repository root	local	all	git checkout .	closed	git_worktree_state_compat::checkout_dot_reports_updated_paths_like_stock_git	positional argument surface accepts dot pathspec checkout and restores missing tracked files with stock output
Branching and Merging	checkout	<pathspec>	a.txt	-- separator path checkout	missing tracked file selected through explicit pathspec	local	all	git checkout -- a.txt	closed	git_worktree_state_compat::checkout_separator_pathspec_omits_updated_paths_like_stock_git	separator path checkout restores the selected tracked file while matching stock stdout/stderr behavior
Branching and Merging	checkout	--recurse-submodules	<empty>	dot pathspec checkout	dirty tracked root file with no submodule recursion needed	local	all	git checkout --recurse-submodules .	closed	git_worktree_state_compat::checkout_recurse_submodules_flag_keeps_dot_pathspec_like_stock_git	--recurse-submodules preserves dot pathspec checkout semantics and restores the tracked root file like stock Git
Branching and Merging	checkout	<none>	process filter returns delayed status	path checkout with -- separator	required smudge filter on tracked path with missing worktree file	local	unix	git checkout -- a.bad	invalid-input	git_worktree_state_compat::checkout_delayed_smudge_process_filter_matches_stock_git_failure	delayed smudge-process-filter status exits 128 with stock external-filter diagnostics and leaves the worktree file absent
