group	command	option	value	combination	repo_state	transport	platform	stock_git_case	zmin_status	evidence	notes
Sequencer Commands	cherry-pick	<positional:commits>	<commit>	clean single commit	current branch plus independent feature commit	local	all	git cherry-pick <feature-commit>	closed	git_sequencer_compat::cherry_pick_and_revert_match_stock_git_for_clean_single_commit	applies a clean single commit with matching tree, commit subject and clean worktree like stock Git
Sequencer Commands	cherry-pick	-m	1	merge commit mainline	current branch at first parent before merge commit	local	all	git cherry-pick -m 1 <merge-commit>	closed	git_sequencer_compat::cherry_pick_and_revert_mainline_merge_match_stock_git	applies the selected mainline parent of a merge commit with matching tree and clean worktree like stock Git
Sequencer Commands	cherry-pick	--abort	<empty>	no cherry-pick in progress	clean repository	local	all	git cherry-pick --abort	invalid-input	git_cli_failure_compat::invalid_option_combinations_match_stock_git_failures	abort without in-progress cherry-pick failure output and exit status match stock Git
Sequencer Commands	cherry-pick	--no-commit	<empty>	independent feature commit	current branch before picked commit	local	all	git cherry-pick --no-commit <feature-commit>	closed	tools/git-cherry-pick-no-commit-schema-oracle-smoke.sh::cherry_pick_no_commit_long	no-commit long form compares exit, stdout, stderr, HEAD, status, index, tree and sequencer side-effect files with stock Git
Sequencer Commands	cherry-pick	-n	<empty>	independent feature commit	current branch before picked commit	local	all	git cherry-pick -n <feature-commit>	closed	tools/git-cherry-pick-no-commit-schema-oracle-smoke.sh::cherry_pick_no_commit_short	no-commit short form compares exit, stdout, stderr, HEAD, status, index, tree and sequencer side-effect files with stock Git
