group	command	option	value	combination	repo_state	transport	platform	stock_git_case	zmin_status	evidence	notes
Plumbing Commands	commit-tree	-m	root	<tree>	index with staged files	local	all	git commit-tree <tree> -m root	closed	git_object_plumbing_compat::write_tree_and_commit_tree_match_stock_git_objects	root commit object id and stored commit content match stock Git for message supplied with -m
Plumbing Commands	commit-tree	<positional:tree>	<tree>	-m root	index with staged files	local	all	git commit-tree <tree> -m root	closed	tools/git-commit-tree-schema-oracle-smoke.sh::commit_tree_positional_tree	positional tree argument creates the same commit object id and stored commit content as stock Git with fixed identity and timestamps
Plumbing Commands	commit-tree	<stdin>	NO	<tree>	separate repository with staged file	local	all	printf 'NO\n' | git commit-tree <tree>	closed	git_object_plumbing_compat::show_pretty_raw_for_commit_tree_records_tree_like_stock_git	stdin message commit object records the same tree line and raw output shape as stock Git
Plumbing Commands	commit-tree	-p	<parent>	<tree> -m child	index with modified staged files and root parent	local	all	git commit-tree <tree> -p <parent> -m child	closed	git_object_plumbing_compat::write_tree_and_commit_tree_match_stock_git_objects	child commit object id matches stock Git for a single parent
Plumbing Commands	commit-tree	-p	<parent>	<tree> -p <parent> -p <parent> -m dedup	index with modified staged files and duplicate parent arguments	local	all	git commit-tree <tree> -p <parent> -p <parent> -m dedup	closed	git_object_plumbing_compat::write_tree_and_commit_tree_match_stock_git_objects	duplicate parent arguments are normalized like stock Git when creating the commit object
