group	command	option	value	combination	repo_state	transport	platform	stock_git_case	zmin_status	evidence	notes
Basic Snapshotting	commit	-m	initial	<none>	staged initial tracked file	local	all	git commit -m initial	closed	git_commit_compat::commit_amend_matches_stock_git_state	initial commit object matches stock Git before amend flow
Basic Snapshotting	commit	--amend	<empty>	-m amended	staged tracked modification	local	all	git commit --amend -m amended	closed	git_commit_compat::commit_amend_matches_stock_git_state	amended commit object, parent list and commit count match stock Git
Basic Snapshotting	commit	--amend	<empty>	-m message only	no staged changes after previous amend	local	all	git commit --amend -m "message only"	closed	git_commit_compat::commit_amend_matches_stock_git_state	message-only amend preserves tree and matches stock Git commit object
Basic Snapshotting	commit	--amend	<empty>	--no-edit staged add	staged new tracked file	local	all	git commit --amend --no-edit	closed	git_commit_compat::commit_amend_matches_stock_git_state	no-edit amend preserves message and matches stock Git commit object
Basic Snapshotting	commit	--amend	<empty>	GIT_EDITOR=: staged add	staged new tracked file	local	all	GIT_EDITOR=: git commit --amend	closed	git_commit_compat::commit_amend_matches_stock_git_state	editor-backed amend reuses message and matches stock Git commit object
Basic Snapshotting	commit	<pathspec>	.	-m "add attrs"	new .gitattributes staged	local	all	git commit -m "add attrs" .	closed	git_commit_compat::commit_dot_pathspec_matches_stock_git_state	dot pathspec commit matches stock Git commit object, porcelain status and index state
Basic Snapshotting	commit	-m	base	<none>	staged initial tracked files	local	all	git commit -m base	closed	git_commit_compat::commit_pathspec_only_and_fixup_match_stock_git_state	base commit object matches stock Git before pathspec and fixup flow
Basic Snapshotting	commit	<pathspec>	a.txt	-m path -- pathspec with unrelated staged file	modified tracked file plus unrelated staged file	local	all	git commit -m path -- a.txt	closed	git_commit_compat::commit_pathspec_only_and_fixup_match_stock_git_state	pathspec commit object, porcelain status and index state match stock Git
Basic Snapshotting	commit	--only	<empty>	-m "only path" a.txt	modified tracked file plus unrelated staged file	local	all	git commit --only -m "only path" a.txt	closed	git_commit_compat::commit_pathspec_only_and_fixup_match_stock_git_state	only path commit object and remaining porcelain status match stock Git
Basic Snapshotting	commit	-o	<empty>	-m only -- a.txt with unrelated staged file	two staged tracked modifications	local	all	git -c commit.gpgsign=false commit -o -m only -- a.txt	closed	tools/git-commit-short-options-oracle-smoke.sh::commit_only_short	short only option commits selected path and leaves unrelated staged file with stock-compatible object, output, HEAD and status
Basic Snapshotting	commit	--fixup	HEAD	<none>	staged tracked modification	local	all	git commit --fixup HEAD	closed	git_commit_compat::commit_pathspec_only_and_fixup_match_stock_git_state	fixup subject and commit object match stock Git
Basic Snapshotting	commit	--fixup	HEAD	-m "fixup detail"	staged tracked modification	local	all	git commit --fixup HEAD -m "fixup detail"	closed	git_commit_compat::commit_pathspec_only_and_fixup_match_stock_git_state	fixup commit with additional message paragraph matches stock Git
Basic Snapshotting	commit	--fixup	amend:HEAD	GIT_EDITOR=custom staged file	staged new tracked file	local	all	GIT_EDITOR=.git/editor.sh git commit --fixup=amend:HEAD	closed	git_commit_compat::commit_pathspec_only_and_fixup_match_stock_git_state	amend fixup output, editor input and commit object match stock Git
Basic Snapshotting	commit	--fixup	reword:HEAD	GIT_EDITOR=custom staged file	staged new tracked file	local	all	GIT_EDITOR=.git/editor.sh git commit --fixup=reword:HEAD	closed	git_commit_compat::commit_pathspec_only_and_fixup_match_stock_git_state	reword fixup output, editor input, commit object, porcelain status and index state match stock Git
Basic Snapshotting	commit	-m	subject	-m body	staged tracked file	local	all	git commit -m subject -m body	closed	git_commit_compat::commit_messages_match_stock_git_object	multiple -m paragraphs match stock Git commit object
Basic Snapshotting	commit	-F	message.txt	<none>	staged tracked files plus message file	local	all	git commit -F message.txt	closed	git_commit_compat::commit_messages_match_stock_git_object	file-backed message matches stock Git commit object
Basic Snapshotting	commit	--file	msg.txt	<none>	staged tracked modification with message file	local	all	git -c commit.gpgsign=false commit --file msg.txt	closed	tools/git-commit-alias-oracle-smoke.sh::commit_file_long	long file option matches stock commit object, output, HEAD and porcelain status
Basic Snapshotting	commit	--allow-empty-message	<empty>	-m ""	staged tracked file	local	all	git commit --allow-empty-message -m ""	closed	git_commit_compat::commit_messages_match_stock_git_object	empty message commit matches stock Git commit object
Basic Snapshotting	commit	--amend	<empty>	-m amended -m details staged add	staged new tracked file	local	all	git commit --amend -m amended -m details	closed	git_commit_compat::commit_messages_match_stock_git_object	amend with multiple message paragraphs matches stock Git commit object
Basic Snapshotting	commit	-C	HEAD	<none>	staged new tracked file	local	all	git commit -C HEAD	closed	git_commit_compat::commit_reuse_message_matches_stock_git_object	reused HEAD message matches stock Git commit object
Basic Snapshotting	commit	--reuse-message	HEAD~1	<none>	staged tracked modification	local	all	git -c commit.gpgsign=false commit --reuse-message HEAD~1	closed	tools/git-commit-alias-oracle-smoke.sh::commit_reuse_message_long	long reuse-message option matches stock commit object, output, HEAD and porcelain status
Basic Snapshotting	commit	-C	HEAD~1	--author and --date overrides	staged new tracked file	local	all	git commit -C HEAD~1 --author "Alice Example <alice@example.test>" --date "1700001234 +0000"	closed	git_commit_compat::commit_reuse_message_matches_stock_git_object	reused message with explicit author and date overrides matches stock Git commit object
Basic Snapshotting	commit	-c	HEAD~2	GIT_EDITOR=custom staged file	staged new tracked file	local	all	GIT_EDITOR=.git/editor.sh git commit -c HEAD~2	closed	git_commit_compat::commit_reuse_message_matches_stock_git_object	reedit reused message output, editor input and commit object match stock Git
Basic Snapshotting	commit	--reedit-message	HEAD~1	GIT_EDITOR=custom staged file	staged tracked modification	local	all	GIT_EDITOR=.git/editor.sh git -c commit.gpgsign=false commit --reedit-message HEAD~1	closed	tools/git-commit-alias-oracle-smoke.sh::commit_reedit_message_long	long reedit-message option matches stock commit object, output, HEAD and porcelain status
Basic Snapshotting	commit	-c	HEAD~3	GIT_EDITOR=unchanged-message editor	staged new tracked file	local	all	GIT_EDITOR=.git/editor.sh git commit -c HEAD~3	closed	git_commit_compat::commit_reuse_message_matches_stock_git_object	reedit unchanged reused message output and commit object match stock Git
Basic Snapshotting	commit	-e	<empty>	-m subject -m body staged file	staged new tracked file	local	all	GIT_EDITOR=.git/editor.sh git commit -e -m "Msg subject" -m "Msg body"	closed	git_commit_compat::commit_edit_and_no_edit_message_sources_match_stock_git	edit flag with message paragraphs invokes editor and matches stock Git commit object
Basic Snapshotting	commit	--edit	<empty>	--file msg.txt staged tracked modification	staged tracked modification with message file	local	all	GIT_EDITOR=.git/editor.sh git -c commit.gpgsign=false commit --edit --file msg.txt	closed	tools/git-commit-alias-oracle-smoke.sh::commit_edit_long	long edit option with file-backed message invokes editor and matches stock commit object, output, HEAD and porcelain status
Basic Snapshotting	commit	-e	<empty>	-F msg.txt staged file	staged new tracked file	local	all	GIT_EDITOR=.git/editor.sh git commit -e -F msg.txt	closed	git_commit_compat::commit_edit_and_no_edit_message_sources_match_stock_git	edit flag with file-backed message invokes editor and matches stock Git commit object
Basic Snapshotting	commit	-e	<empty>	-C HEAD staged file	staged new tracked file	local	all	GIT_EDITOR=.git/editor.sh git commit -e -C HEAD	closed	git_commit_compat::commit_edit_and_no_edit_message_sources_match_stock_git	edit flag with reused message invokes editor and matches stock Git commit object
Basic Snapshotting	commit	--no-edit	<empty>	-c HEAD staged file	staged new tracked file	local	all	GIT_EDITOR=.git/editor.sh git commit --no-edit -c HEAD	closed	git_commit_compat::commit_edit_and_no_edit_message_sources_match_stock_git	no-edit suppresses reedit editor and matches stock Git commit object
Basic Snapshotting	commit	--no-edit	<empty>	-m "No edit subject" staged file	staged new tracked file	local	all	GIT_EDITOR=.git/editor.sh git commit --no-edit -m "No edit subject"	closed	git_commit_compat::commit_edit_and_no_edit_message_sources_match_stock_git	no-edit with explicit message avoids editor and matches stock Git commit object
Basic Snapshotting	commit	-m	initial	normal output root commit	staged new tracked files	local	all	git commit -m initial	closed	git_commit_compat::commit_summary_and_quiet_output_match_stock_git	root commit summary output matches stock Git
Basic Snapshotting	commit	-m	second	normal output tracked modification	staged tracked modification	local	all	git commit -m second	closed	git_commit_compat::commit_summary_and_quiet_output_match_stock_git	update commit summary output matches stock Git
Basic Snapshotting	commit	-m	delete	normal output tracked deletion	staged tracked deletion	local	all	git commit -m delete	closed	git_commit_compat::commit_summary_and_quiet_output_match_stock_git	delete commit summary output matches stock Git
Basic Snapshotting	commit	--quiet	<empty>	-m quiet staged add	staged new tracked file	local	all	git commit --quiet -m quiet	closed	git_commit_compat::commit_summary_and_quiet_output_match_stock_git	quiet commit suppresses summary output like stock Git
Basic Snapshotting	commit	-q	<empty>	-m quiet staged modification	staged tracked modification	local	all	git -c commit.gpgsign=false commit -q -m quiet	closed	tools/git-commit-short-options-oracle-smoke.sh::commit_quiet_short	short quiet option suppresses summary output and matches stock commit object, HEAD and porcelain status
Basic Snapshotting	commit	--all	<empty>	-m all-long tracked modification with untracked file	modified tracked file plus unrelated untracked file	local	all	git -c commit.gpgsign=false commit --all -m all-long	closed	tools/git-commit-all-oracle-smoke.sh::commit_all_long	all option stages tracked modifications, leaves untracked files alone and matches stock commit object, output, status and index state
Basic Snapshotting	commit	-a	<empty>	-m all-short tracked modification with untracked file	modified tracked file plus unrelated untracked file	local	all	git -c commit.gpgsign=false commit -a -m all-short	closed	tools/git-commit-all-oracle-smoke.sh::commit_all_short	short all option stages tracked modifications, leaves untracked files alone and matches stock commit object, output, status and index state
Basic Snapshotting	commit	--cleanup	strip	-F message.txt	staged tracked modification	local	all	git commit --cleanup strip -F message.txt	closed	git_commit_compat::commit_cleanup_modes_match_stock_git_object	strip cleanup mode commit object matches stock Git
Basic Snapshotting	commit	--cleanup	whitespace	-F message.txt	staged tracked modification	local	all	git commit --cleanup whitespace -F message.txt	closed	git_commit_compat::commit_cleanup_modes_match_stock_git_object	whitespace cleanup mode commit object matches stock Git
Basic Snapshotting	commit	--cleanup	default	-F message.txt	staged tracked modification	local	all	git commit --cleanup default -F message.txt	closed	git_commit_compat::commit_cleanup_modes_match_stock_git_object	default cleanup mode commit object matches stock Git
Basic Snapshotting	commit	--no-cleanup	<empty>	-F message.txt	staged tracked modification	local	all	git commit --no-cleanup -F message.txt	closed	git_commit_compat::commit_cleanup_modes_match_stock_git_object	no-cleanup mode commit object matches stock Git
Basic Snapshotting	commit	--trailer	Reviewed-by: Alice <alice@example.test>	-m subject	staged tracked file	local	all	git commit -m subject --trailer "Reviewed-by: Alice <alice@example.test>"	closed	git_commit_compat::commit_trailers_match_stock_git_object_and_editor_buffer	message trailer commit object matches stock Git
Basic Snapshotting	commit	--trailer	Refs: #123	-F message.txt	staged tracked modification	local	all	git commit -F message.txt --trailer "Refs: #123"	closed	git_commit_compat::commit_trailers_match_stock_git_object_and_editor_buffer	file-backed message trailer commit object matches stock Git
Basic Snapshotting	commit	--trailer	A: one	repeated --trailer B=two	staged tracked modification	local	all	git commit -m subject --trailer "A: one" --trailer "B=two"	closed	git_commit_compat::commit_trailers_match_stock_git_object_and_editor_buffer	repeated trailer commit object matches stock Git
Basic Snapshotting	commit	--signoff	<empty>	--trailer Reviewed-by staged file	staged tracked modification	local	all	git commit --signoff -m subject --trailer "Reviewed-by: Alice <alice@example.test>"	closed	git_commit_compat::commit_trailers_match_stock_git_object_and_editor_buffer	signoff plus trailer commit object matches stock Git
Basic Snapshotting	commit	--trailer	Reviewed-by: Alice <alice@example.test>	GIT_EDITOR=custom staged file	staged tracked modification	local	all	GIT_EDITOR=.git/editor.sh git commit --trailer "Reviewed-by: Alice <alice@example.test>"	closed	git_commit_compat::commit_trailers_match_stock_git_object_and_editor_buffer	editor-backed trailer output, editor input and commit object match stock Git
Basic Snapshotting	commit	<none>	<empty>	failing pre-commit hook	staged tracked file	local	all	git commit -m fail	closed	git_commit_compat::commit_hook_failures_match_stock_git_flow	failing pre-commit hook output, exit status and absent HEAD match stock Git
Basic Snapshotting	commit	<none>	<empty>	failing commit-msg hook	staged tracked file	local	all	git commit -m fail	closed	git_commit_compat::commit_hook_failures_match_stock_git_flow	failing commit-msg hook output, exit status and absent HEAD match stock Git
Basic Snapshotting	commit	<none>	<empty>	failing post-commit hook	staged tracked file	local	all	git commit -m post	closed	git_commit_compat::commit_hook_failures_match_stock_git_flow	failing post-commit hook still creates commit and matches stock Git output behavior
Basic Snapshotting	commit	--no-status	<empty>	GIT_EDITOR=custom staged file	staged new tracked file	local	all	GIT_EDITOR=.git/editor.sh git commit --no-status	closed	git_commit_compat::commit_status_option_and_config_match_stock_git_buffer	no-status editor buffer omits the status template and commit object matches stock Git
Basic Snapshotting	commit	<none>	commit.status=false	GIT_EDITOR=custom staged file	staged new tracked file with commit.status=false	local	all	GIT_EDITOR=.git/editor.sh git commit	closed	git_commit_compat::commit_status_option_and_config_match_stock_git_buffer	commit.status=false editor buffer omits the status template and commit object matches stock Git
Basic Snapshotting	commit	--status	<empty>	commit.status=false GIT_EDITOR=custom staged file	staged new tracked file with commit.status=false	local	all	GIT_EDITOR=.git/editor.sh git commit --status	closed	git_commit_compat::commit_status_option_and_config_match_stock_git_buffer	explicit status overrides commit.status=false and editor buffer matches stock Git
Basic Snapshotting	commit	-v	<empty>	--no-status GIT_EDITOR=custom staged file	staged new tracked file	local	all	GIT_EDITOR=.git/editor.sh git commit -v --no-status	closed	git_commit_compat::commit_status_option_and_config_match_stock_git_buffer	verbose diff remains while no-status suppresses the status template like stock Git
Basic Snapshotting	commit	--verbose	<empty>	--no-status GIT_EDITOR=custom staged file	staged tracked modification	local	all	GIT_EDITOR=.git/editor.sh git -c commit.gpgsign=false commit --verbose --no-status	closed	tools/git-commit-short-options-oracle-smoke.sh::commit_verbose_long	long verbose option with no-status editor flow matches stock commit object, output, HEAD and porcelain status
Basic Snapshotting	commit	--template	template.txt	GIT_EDITOR=custom staged file	staged new tracked file	local	all	GIT_EDITOR=./editor.sh git commit --template template.txt	closed	git_commit_compat::commit_template_editor_matches_stock_git_object	template-backed editor commit output and object match stock Git
Basic Snapshotting	commit	-t	template.txt	GIT_EDITOR=custom staged file	staged tracked modification	local	all	GIT_EDITOR=.git/editor.sh git -c commit.gpgsign=false commit -t template.txt	closed	tools/git-commit-short-options-oracle-smoke.sh::commit_template_short	short template option invokes editor and matches stock commit object, output, HEAD and porcelain status
Basic Snapshotting	commit	<none>	commit.template=config-template.txt	GIT_EDITOR=custom staged file	staged new tracked file with commit.template configured	local	all	GIT_EDITOR=./editor.sh git commit	closed	git_commit_compat::commit_template_editor_matches_stock_git_object	configured commit.template editor commit output and object match stock Git
Basic Snapshotting	commit	<none>	<empty>	GIT_EDITOR=custom staged file	staged new tracked file	local	all	GIT_EDITOR=.git/editor.sh git commit	closed	git_commit_compat::commit_editor_without_message_matches_stock_git_buffer	editor-backed commit without message source captures stock editor buffer and commit object
Basic Snapshotting	commit	<none>	<empty>	GIT_EDITOR=unchanged buffer	staged new tracked file	local	all	GIT_EDITOR=.git/editor.sh git commit	invalid-input	git_commit_compat::commit_editor_empty_and_unchanged_abort_like_stock_git	unchanged editor buffer aborts with stock failure output and no commit
Basic Snapshotting	commit	<none>	<empty>	GIT_EDITOR=empty buffer	staged new tracked file	local	all	GIT_EDITOR=.git/editor.sh git commit	invalid-input	git_commit_compat::commit_editor_empty_and_unchanged_abort_like_stock_git	empty editor buffer aborts with stock failure output and no commit
Basic Snapshotting	commit	--template	.git/template.txt	-v GIT_EDITOR=custom staged files	staged modified and new tracked files	local	all	GIT_EDITOR=.git/editor.sh git commit --template .git/template.txt -v	closed	git_commit_compat::commit_verbose_template_editor_matches_stock_git_buffer	verbose template editor buffer includes stock cached diff and commit object matches stock Git
Basic Snapshotting	commit	--template	.git/template.txt	-vv GIT_EDITOR=custom staged files with unstaged change	staged modified and new tracked files plus unstaged modification	local	all	GIT_EDITOR=.git/editor.sh git commit --template .git/template.txt -vv	closed	git_commit_compat::commit_verbose_verbose_template_editor_matches_stock_git_buffer	double verbose template editor buffer includes stock cached and unstaged diffs and commit object matches stock Git
Basic Snapshotting	commit	--template	template.txt	GIT_EDITOR=true unchanged template	staged new tracked file	local	all	GIT_EDITOR=true git commit --template template.txt	invalid-input	git_commit_compat::commit_template_requires_editor_change_like_stock_git	unchanged template commit aborts with stock failure output
Basic Snapshotting	commit	--message	empty	--allow-empty	unborn branch with no staged files	local	all	git commit --allow-empty --message empty	closed	git_commit_compat::commit_long_message_option_matches_stock_git_object	long --message spelling creates the same commit message as stock Git
Basic Snapshotting	commit	--author	Alice Example <alice@example.test>	-m author	staged new tracked file	local	all	git commit --author "Alice Example <alice@example.test>" -m author	closed	git_commit_compat::commit_author_matches_stock_git_object	explicit author identity in commit object and log output matches stock Git
Basic Snapshotting	commit	--date	1700001234 +0000	-m date	staged new tracked file	local	all	git commit --date "1700001234 +0000" -m date	closed	git_commit_compat::commit_date_matches_stock_git_object	explicit author date in commit object matches stock Git
Basic Snapshotting	commit	--amend	<empty>	--author Alice --date 1700001234 +0000 -m amended	staged tracked modification	local	all	git commit --amend --author "Alice Example <alice@example.test>" --date "1700001234 +0000" -m amended	closed	git_commit_compat::commit_amend_author_date_options_match_stock_git_object	amend with explicit author and date produces stock-compatible commit object
Basic Snapshotting	commit	--reset-author	<empty>	--amend -m reset	amending commit with previous explicit author/date	local	all	git commit --amend --reset-author -m reset	closed	git_commit_compat::commit_reset_author_matches_stock_git_object	reset-author amend resets author metadata like stock Git
Basic Snapshotting	commit	--signoff	<empty>	--allow-empty-message -m ""	staged tracked modification	local	all	git commit --allow-empty-message --signoff -m ""	closed	git_commit_compat::commit_signoff_matches_stock_git_object	signoff with empty allowed message produces stock-compatible commit object
Basic Snapshotting	commit	--signoff	<empty>	-m subject -m details	staged tracked modification	local	all	git commit --signoff -m subject -m details	closed	git_commit_compat::commit_signoff_matches_stock_git_object	signoff with subject and body produces stock-compatible commit object
Basic Snapshotting	commit	-s	<empty>	-m subject staged modification	staged tracked modification	local	all	git -c commit.gpgsign=false commit -s -m subject	closed	tools/git-commit-short-options-oracle-smoke.sh::commit_signoff_short	short signoff option appends stock trailer and matches commit object, output, HEAD and porcelain status
Basic Snapshotting	commit	--squash	HEAD~1	-m work	staged tracked modification after target commit	local	all	git commit --squash HEAD~1 -m work	closed	git_commit_compat::commit_squash_matches_stock_git_object	squash commit subject/body and object match stock Git
Basic Snapshotting	commit	<none>	<empty>	normal hook flow with -m subject	staged new tracked file with pre-commit, commit-msg and post-commit hooks	local	all	git commit -m subject	closed	git_commit_compat::commit_hooks_match_stock_git_flow	successful commit hook output, hook log and commit object match stock Git
Basic Snapshotting	commit	--no-verify	<empty>	-m skip	staged new tracked file with pre-commit, commit-msg and post-commit hooks	local	all	git commit --no-verify -m skip	closed	git_commit_compat::commit_hooks_match_stock_git_flow	no-verify skips verification hooks and hook log matches stock Git
Basic Snapshotting	commit	-n	<empty>	-m skip with failing pre-commit hook	staged tracked modification with failing pre-commit hook	local	all	git -c commit.gpgsign=false commit -n -m skip	closed	tools/git-commit-short-options-oracle-smoke.sh::commit_no_verify_short	short no-verify option skips failing pre-commit hook and matches stock output, hook log absence, commit object, HEAD and status
Basic Snapshotting	commit	--no-verify	<empty>	-m subject with prepare-commit-msg hook	staged new tracked file with prepare-commit-msg hook	local	all	git commit --no-verify -m subject	closed	git_commit_compat::commit_prepare_and_post_rewrite_hooks_match_stock_git_flow	prepare-commit-msg still runs under no-verify and hook log plus commit object match stock Git
Basic Snapshotting	commit	--amend	<empty>	-m amended with post-rewrite hook	staged new tracked file amending previous commit	local	all	git commit --amend -m amended	closed	git_commit_compat::commit_prepare_and_post_rewrite_hooks_match_stock_git_flow	post-rewrite hook log for amend matches stock Git
