group	command	option	value	combination	repo_state	transport	platform	stock_git_case	zmin_status	evidence	notes
Plumbing Commands	diff-tree	-c	<empty>	merge commit operand	merge history	local	all	git diff-tree -c main	closed	git_diff_compat::diff_tree_combined_raw_for_merge_matches_stock_git	combined raw diff-tree output for a merge commit matches stock Git
Plumbing Commands	diff-tree	-c	<empty>	--abbrev merge commit operand	merge history	local	all	git diff-tree -c --abbrev main	closed	git_diff_compat::diff_tree_combined_raw_for_merge_matches_stock_git	combined abbreviated raw diff-tree output for a merge commit matches stock Git
Plumbing Commands	diff-tree	--abbrev	<empty>	-c merge commit operand	merge history	local	all	git diff-tree -c --abbrev main	closed	git_diff_compat::diff_tree_combined_raw_for_merge_matches_stock_git	abbrev option with combined raw diff-tree output matches stock Git
Plumbing Commands	diff-tree	--cc	<empty>	merge commit operand	merge history	local	all	git diff-tree --cc main	closed	git_diff_compat::diff_tree_combined_raw_for_merge_matches_stock_git	dense-combined raw diff-tree output for a merge commit matches stock Git
Plumbing Commands	diff-tree	--stat	<empty>	-c merge commit operand	merge history	local	all	git diff-tree -c --stat main	closed	git_diff_compat::diff_tree_combined_raw_for_merge_matches_stock_git	combined diff-tree stat output matches stock Git
Plumbing Commands	diff-tree	--stat	<empty>	--cc merge commit operand	merge history	local	all	git diff-tree --cc --stat main	closed	git_diff_compat::diff_tree_combined_raw_for_merge_matches_stock_git	dense-combined diff-tree stat output matches stock Git
Plumbing Commands	diff-tree	--patch-with-stat	<empty>	--cc --summary commit operand	merge history	local	all	git diff-tree --cc --patch-with-stat --summary side	closed	git_diff_compat::diff_tree_combined_raw_for_merge_matches_stock_git	dense-combined patch-with-stat and summary diff-tree output matches stock Git
