group	command	option	value	combination	repo_state	transport	platform	stock_git_case	zmin_status	evidence	notes
Administration	gc	--prune	now	--quiet reachable-object packing	repository with loose reachable objects	local	all	git gc --prune=now --quiet	closed	git_maintenance_compat::gc_packs_reachable_objects_and_keeps_head_readable	prune-now packs reachable objects, prunes loose copies and keeps HEAD readable
Administration	gc	--quiet	<empty>	--prune=now reachable-object packing	repository with loose reachable objects	local	all	git gc --prune=now --quiet	closed	git_maintenance_compat::gc_packs_reachable_objects_and_keeps_head_readable	quiet prune-now gc emits stock-compatible empty output and side effects
Administration	gc	--auto	<empty>	auto threshold no-op	small repository below auto-gc thresholds	local	all	git gc --auto	closed	tools/git-gc-schema-oracle-smoke.sh::gc_auto_long	auto-gc no-op matches stock exit, stdout, stderr and object-file side effects
Administration	gc	-q	<empty>	default reachable-object packing	repository with reachable commits	local	all	git gc -q	open	tools/git-gc-schema-oracle-smoke.sh::gc_quiet_short	stock Git writes commit-graph/object-pack side effects that differ from Zmin, despite matching exit, stdout, stderr and fsck
Administration	gc	--no-prune	<empty>	--quiet reachable-object packing	repository with reachable commits	local	all	git gc --no-prune --quiet	open	tools/git-gc-schema-oracle-smoke.sh::gc_no_prune_long	stock Git writes commit-graph/object-pack side effects that differ from Zmin, despite matching exit, stdout, stderr and fsck
Administration	gc	--aggressive	<empty>	--quiet delta pack generation	repository with related blobs	local	all	git gc --aggressive --quiet	closed	git_maintenance_compat::gc_aggressive_writes_stock_readable_delta_pack	aggressive gc writes stock-readable delta pack with matching delta base linkage
