group	command	option	value	combination	repo_state	transport	platform	stock_git_case	zmin_status	evidence	notes
Plumbing	merge-index	<positional:merge_program>	git-merge-one-file	-a unmerged entries	unmerged index stages 1/2/3	local	all	git merge-index git-merge-one-file -a	closed	git_merge_plumbing_compat::merge_index_runs_merge_one_file_for_unmerged_entries	merge program positional argument runs stock-compatible merge-one-file helper
Plumbing	merge-index	-a	<empty>	git-merge-one-file over all unmerged entries	unmerged index stages 1/2/3	local	all	git merge-index git-merge-one-file -a	closed	git_merge_plumbing_compat::merge_index_runs_merge_one_file_for_unmerged_entries	all-unmerged selector runs helper and updates worktree/index like stock Git
Plumbing	merge-index	-o	<empty>	git-merge-one-file file.txt	unmerged index stages 1/2/3	local	all	git merge-index -o git-merge-one-file file.txt	open	tools/git-merge-index-schema-oracle-smoke.sh::merge_index_one_shot_path	one-shot path form has output and side-effect gaps: stock Git omits merge chatter and leaves file.txt unmerged while Zmin currently prints Auto-merging and stages the resolved file
Plumbing	merge-index	-q	<empty>	git-merge-one-file file.txt	unmerged index stages 1/2/3	local	all	git merge-index -q git-merge-one-file file.txt	open	tools/git-merge-index-schema-oracle-smoke.sh::merge_index_quiet_path	quiet path form has a side-effect gap: stock Git leaves file.txt unmerged while Zmin currently stages the resolved file
Plumbing	merge-index	<positional:paths>	file.txt	git-merge-one-file	unmerged index stages 1/2/3	local	all	git merge-index git-merge-one-file file.txt	open	tools/git-merge-index-schema-oracle-smoke.sh::merge_index_explicit_path	explicit path positional form has output and side-effect gaps: stock Git leaves file.txt unmerged while Zmin currently prints Auto-merging and stages the resolved file
