group	command	option	value	combination	repo_state	transport	platform	stock_git_case	zmin_status	evidence	notes
Basic Snapshotting	mv	<none>	a.txt renamed.txt	default tracked file move	tracked file/local index	local	all	git mv a.txt renamed.txt	closed	git_index_mutation_compat::mv_file_and_directory_match_stock_git_tree_after_commit	default file move leaves committed tree/status matching stock Git
Basic Snapshotting	mv	<positional:paths>	a.txt renamed.txt	default tracked file move	tracked file/local index	local	all	git mv a.txt renamed.txt	closed	git_index_mutation_compat::mv_file_and_directory_match_stock_git_tree_after_commit	positional source and destination move tracked file like stock Git
Basic Snapshotting	mv	<positional:paths>	dir renamed-dir	tracked directory move	tracked directory/local index	local	all	git mv dir renamed-dir	closed	git_index_mutation_compat::mv_file_and_directory_match_stock_git_tree_after_commit	positional source and destination move tracked directory like stock Git
Basic Snapshotting	mv	--force	a.txt dst.txt	overwrite tracked destination	tracked source and tracked destination	local	all	git mv --force a.txt dst.txt	closed	tools/git-force-schema-oracle-smoke.sh::mv_force_long	force long form overwrites the tracked destination with stdout, stderr, status and index matching stock Git
Basic Snapshotting	mv	-f	a.txt dst.txt	overwrite tracked destination	tracked source and tracked destination	local	all	git mv -f a.txt dst.txt	closed	tools/git-force-schema-oracle-smoke.sh::mv_force_short	force short form overwrites the tracked destination with stdout, stderr, status and index matching stock Git
