group	command	option	value	combination	repo_state	transport	platform	stock_git_case	zmin_status	evidence	notes
Other Git 2.47 commands	patch-id	<none>	<empty>	stdin diff patch	modified tracked file	local	all	git patch-id < diff.patch	closed	git_apply_compat::patch_id_matches_stock_git_for_diff_and_log_patches	default patch-id output for a single diff patch matches stock Git
Other Git 2.47 commands	patch-id	--stable	<empty>	stdin diff patch	modified tracked file	local	all	git patch-id --stable < diff.patch	closed	git_apply_compat::patch_id_matches_stock_git_for_diff_and_log_patches	stable patch-id output for a single diff patch matches stock Git
Other Git 2.47 commands	patch-id	--unstable	<empty>	stdin diff patch	modified tracked file	local	all	git patch-id --unstable < diff.patch	closed	git_apply_compat::patch_id_matches_stock_git_for_diff_and_log_patches	unstable patch-id output for a single diff patch matches stock Git
Other Git 2.47 commands	patch-id	--verbatim	<empty>	stdin diff patch	modified tracked file with whitespace change	local	all	git patch-id --verbatim < diff.patch	closed	git_apply_compat::patch_id_matches_stock_git_for_diff_and_log_patches	verbatim patch-id preserves whitespace-sensitive input like stock Git
Other Git 2.47 commands	patch-id	--stable	<empty>	stdin log patch stream	two recent commits with patch output	local	all	git patch-id --stable < log.patch	closed	git_apply_compat::patch_id_matches_stock_git_for_diff_and_log_patches	stable patch-id output for a multi-commit log patch stream matches stock Git
Other Git 2.47 commands	patch-id	--unstable	<empty>	stdin log patch stream	two recent commits with patch output	local	all	git patch-id --unstable < log.patch	closed	git_apply_compat::patch_id_matches_stock_git_for_diff_and_log_patches	unstable patch-id output for a multi-commit log patch stream matches stock Git
