group	command	option	value	combination	repo_state	transport	platform	stock_git_case	zmin_status	evidence	notes
Other Git 2.47 commands	prune	<none>	<empty>	default expiry	unreachable loose object	local	all	git prune	closed	git_maintenance_compat::prune_without_expire_matches_stock_git_for_unreachable_loose_objects	default expiry prunes unreachable loose objects like stock Git
Other Git 2.47 commands	prune	--expire	now	-n path limiter	unreachable and explicitly kept loose objects	local	all	git prune -n --expire=now <object>	closed	git_maintenance_compat::prune_matches_stock_git_for_unreachable_loose_objects	dry-run with now expiry and explicit object limiter matches stock stdout and keeps objects
Other Git 2.47 commands	prune	--expire	now	path limiter	unreachable and explicitly kept loose objects	local	all	git prune --expire=now <object>	closed	git_maintenance_compat::prune_matches_stock_git_for_unreachable_loose_objects	now expiry prunes only eligible unreachable loose objects while keeping explicit and staged objects like stock Git
Other Git 2.47 commands	prune	<args>	<object>	--expire=now path limiter	unreachable and explicitly kept loose objects	local	all	git prune --expire=now <object>	closed	git_maintenance_compat::prune_matches_stock_git_for_unreachable_loose_objects	positional object limiter is parsed and keeps the explicit object while pruning only eligible unreachable loose objects like stock Git
Other Git 2.47 commands	prune	--expire	now	<empty>	reflog-reachable loose object	local	all	git prune --expire=now	closed	git_maintenance_compat::prune_preserves_objects_reachable_from_reflogs	reflog-reachable objects stay present like stock Git
Other Git 2.47 commands	prune	--expire	never	--no-exclude-promisor-objects path limiter	unreachable loose object	local	all	git prune --no-exclude-promisor-objects --expire=never <object>	closed	git_maintenance_compat::prune_matches_stock_git_for_negated_options	never expiry keeps unreachable loose objects and accepts no-exclude-promisor-objects like stock Git
Other Git 2.47 commands	prune	--expire	now	-n --no-dry-run -v --no-verbose --no-progress path limiter	unreachable loose object	local	all	git prune -n --no-dry-run -v --no-verbose --no-progress --expire=now <object>	closed	git_maintenance_compat::prune_matches_stock_git_for_negated_options	negated dry-run and verbose options resolve like stock Git and prune eligible loose objects
Other Git 2.47 commands	prune	--expire	bogus	<empty>	clean repository	local	all	git prune --expire=bogus	invalid-input	git_maintenance_compat::prune_invalid_expire_value_matches_stock_git	malformed expiry value exits with stock fatal diagnostic and exit code
