group	command	option	value	combination	repo_state	transport	platform	stock_git_case	zmin_status	evidence	notes
Other Git 2.47 commands	scalar	delete	<empty>	<enlistment>	registered local enlistment	local	all	scalar delete <enlistment>	closed	git_scalar_compat::scalar_delete_matches_stock_scalar_shape	delete subcommand stdout/stderr/exit and enlistment removal match stock scalar
Other Git 2.47 commands	scalar	list	<empty>	after register/unregister	global scalar config	local	all	scalar list	closed	git_scalar_compat::scalar_register_list_unregister_match_stock_scalar_shape	list subcommand stdout/stderr/exit matches stock scalar around register and unregister
Other Git 2.47 commands	scalar	reconfigure	<empty>	--maintenance=keep <enlistment>	registered local repository	local	all	scalar reconfigure --maintenance=keep <enlistment>	closed	git_scalar_compat::scalar_run_config_and_reconfigure_keep_match_stock_scalar_config_effects	reconfigure subcommand output and config side effects match stock scalar for keep mode
Other Git 2.47 commands	scalar	register	<empty>	--no-maintenance <enlistment>	local repository	local	all	scalar register --no-maintenance <enlistment>	closed	git_scalar_compat::scalar_register_list_unregister_match_stock_scalar_shape	register subcommand stdout/stderr/exit matches stock scalar and records scalar.repo
Other Git 2.47 commands	scalar	run	<empty>	config <enlistment>	local repository	local	all	scalar run config <enlistment>	closed	git_scalar_compat::scalar_run_config_and_reconfigure_keep_match_stock_scalar_config_effects	run config subcommand output and config side effects match stock scalar
Other Git 2.47 commands	scalar	unregister	<empty>	<enlistment>	registered local repository	local	all	scalar unregister <enlistment>	closed	git_scalar_compat::scalar_register_list_unregister_match_stock_scalar_shape	unregister subcommand stdout/stderr/exit matches stock scalar and removes scalar.repo
